{
  "version": 1,
  "workspace": "../..",
  "outputDir": "../../.subagent-runs",
  "concurrency": 1,
  "defaults": {
    "model": "sonnet",
    "effort": "low",
    "timeoutMs": 120000,
    "permissionMode": "default",
    "tools": []
  },
  "tasks": [
    {
      "id": "runner-smoke",
      "title": "Runner structured output smoke test",
      "kind": "verify",
      "prompt": "Do not inspect or edit files. Return a successful structured result saying the runner smoke test passed. Put one verification item named 'json-schema-output'."
    }
  ]
}
